{
  "schema_version": 1,
  "id": "wii-w5-dolphin-main-settings",
  "kind": "compatibility_implementation",
  "url": "https://github.com/dolphin-emu/dolphin/blob/409881c34357d0f105fd473167d15ab0bd9c1628/Source/Core/Core/Config/MainSettings.cpp",
  "revision": "409881c34357d0f105fd473167d15ab0bd9c1628",
  "sha256": "b66a7cd93abb24af463ddaa3199462ef9a1bb10465f925508379f29bbe950e29",
  "lineage": "dolphin-emulator",
  "locator": "Installed2609a source pin. MainSettings215-216 names WiimoteControllerInterface; SDLGamepad125-142,354 uses SDL sensor APIs; direct WiimoteController1352-1378,1462-1468 parses MotionPlus with calibration. Source-only; no upstream code redistributed, no physical claim."
}
