{
  "schema_version": 1,
  "id": "wii-w9h-memory-source",
  "kind": "compatibility_implementation",
  "url": "https://github.com/anderstvoss/virtualgamepad/blob/74e5fab1ef05ea695cc6a59f341242da875a8fe0/crates/gr-curated-controllers/src/wii_remote/memory.rs",
  "revision": "74e5fab1ef05ea695cc6a59f341242da875a8fe0",
  "sha256": "1490e93ff1fda33bee1bb2dcb4908e49dadaebc99bbf866abde5d1f468b52ccd",
  "lineage": "anderstvoss/virtualgamepad; virtual source model, not physical hardware",
  "locator": "Immutable creation options gate F6 and 0x40 compatibility reads; Plus inactive identity defaults built-in with optional external style. Calibration comes only from imported caller resources; no physical or factory inference."
}
