{
  "schema_version": 1,
  "id": "wii-gap-consumer-xwiimote-header",
  "kind": "compatibility_implementation",
  "url": "https://github.com/xwiimote/xwiimote/blob/4df713d9037d814cc0c64197f69e5c78d55caaf1/lib/xwiimote.h",
  "revision": "4df713d9037d814cc0c64197f69e5c78d55caaf1",
  "sha256": "2c3dcfd5388cfea6bb12478fb03c8718701b9834a148896ef898b472b871dedd",
  "lineage": "xwiimote/xwiimote",
  "locator": "XWiimote MIT-like; names 326-359; MP node 240-260; event 422-435; normalization scope 1237-1274."
}
