{
  "schema_version": 1,
  "id": "vg-alpha1-exp0016",
  "kind": "research_lead",
  "url": "https://github.com/anderstvoss/virtualgamepad/blob/c60c16409e91e39ddba56a78475bdabe3780d1d0/docs/history/alpha-1/experiments/EXP-0016-consumer-mapping-disagreement.md",
  "revision": "c60c16409e91e39ddba56a78475bdabe3780d1d0",
  "sha256": "b570f5902442991e0d2109893b13122697ed7e326bbfba07a2a31e443d7aead7",
  "lineage": "virtualgamepad",
  "locator": "Historical manual Steam/Eden disagreement and Xbox UHID acceptance documented in EXP-0016-consumer-mapping-disagreement.md. Documentation of earlier runs; raw private logs not imported. Pinned as a document lead; its current repository revision is not the earlier test executable revision."
}
