{
  "schema_version": 1,
  "id": "parity-g-steam-public-rules",
  "kind": "compatibility_implementation",
  "url": "https://github.com/ValveSoftware/steam-devices/blob/22ec85e5ff5ea2e15c56d71a41bcbef46356cd60/60-steam-input.rules",
  "revision": "22ec85e5ff5ea2e15c56d71a41bcbef46356cd60",
  "sha256": "284930f83cf8fde8a247057d46f48083d5e4aefc23a54310db02cfc2dbe42e50",
  "lineage": "steam-devices",
  "locator": "4-65 publicly shipped udev rules for Valve, Sony, Nintendo and others; closed Steam client reads/writes unknown. Reuse steam-client-udev-60-steam-input as canonical source in J."
}
