{
  "schema_version": 1,
  "id": "vg-alpha1-exp0017",
  "kind": "research_lead",
  "url": "https://github.com/anderstvoss/virtualgamepad/blob/c60c16409e91e39ddba56a78475bdabe3780d1d0/docs/history/alpha-1/experiments/EXP-0017-individual-hid-and-rumble.md",
  "revision": "c60c16409e91e39ddba56a78475bdabe3780d1d0",
  "sha256": "78d814e29ea5a4437f1063c34d3e8a9aaa1d148754e3c86d52d464ab46384056",
  "lineage": "virtualgamepad",
  "locator": "Historical four-family individual USB/UHID control acceptance documented in EXP-0017-individual-hid-and-rumble.md. Documentation of earlier runs; raw private logs not imported. Pinned as a document lead; its current repository revision is not the earlier test executable revision."
}
